{
  "version": "v0.33.0-preview.4",
  "releaseDate": "2026-03-06",
  "sourceUrl": "https://github.com/google-gemini/gemini-cli/releases/tag/v0.33.0-preview.4",
  "changes": [
    {
      "type": "feature",
      "description": "## What's Changed\n* fix(patch): cherry-pick 7ec477d to release/v0.33.0-preview.3-pr-21305 to patch version v0.33.0-preview.3 and create version 0.33.0-preview.4 by @gemini-cli-robot in https://github.com/google-gemini/gemini-cli/pull/21349\n\n\n**Full Changelog**: https://github.com/google-gemini/gemini-cli/compare/v0.33.0-preview.3...v0.33.0-preview.4",
      "impact": "minor"
    }
  ],
  "capabilitiesAdded": [],
  "capabilitiesModified": [],
  "capabilitiesRemoved": [],
  "agent": "Gemini CLI"
}