{
  "version": "v0.27.2",
  "releaseDate": "2026-02-05",
  "sourceUrl": "https://github.com/google-gemini/gemini-cli/releases/tag/v0.27.2",
  "changes": [
    {
      "type": "feature",
      "description": "## What's Changed\n* fix(patch): cherry-pick 9ca7300 to release/v0.27.1-pr-18395 to patch version v0.27.1 and create version 0.27.2 by @gemini-cli-robot in https://github.com/google-gemini/gemini-cli/pull/18399\n\n\n**Full Changelog**: https://github.com/google-gemini/gemini-cli/compare/v0.27.1...v0.27.2",
      "impact": "minor"
    }
  ],
  "capabilitiesAdded": [],
  "capabilitiesModified": [],
  "capabilitiesRemoved": [],
  "agent": "Gemini CLI"
}