{
  "version": "v0.30.0-nightly.20260224.544df749a",
  "releaseDate": "2026-02-24",
  "sourceUrl": "https://github.com/google-gemini/gemini-cli/releases/tag/v0.30.0-nightly.20260224.544df749a",
  "changes": [
    {
      "type": "feature",
      "description": "## What's Changed\n* refactor(core): move session conversion logic to core by @abhipatel12 in https://github.com/google-gemini/gemini-cli/pull/19972\n* Fix: Persist manual model selection on restart #19864 by @Nixxx19 in https://github.com/google-gemini/gemini-cli/pull/19891\n* fix(core): increase default retry attempts and add quota error backoff by @sehoon38 in https://github.com/google-gemini/gemini-cli/pull/19949\n* feat(core): add policy chain support for Gemini 3.1 by @sehoon38 in https://github.com/google-gemini/gemini-cli/pull/19991\n* Updates command reference and /stats command. by @g-samroberts in https://github.com/google-gemini/gemini-cli/pull/19794\n* Fix for silent failures in non-interactive mode by @owenofbrien in https://github.com/google-gemini/gemini-cli/pull/19905\n* fix(plan): allow plan mode writes on Windows and fix prompt paths by @Adib234 in https://github.com/google-gemini/gemini-cli/pull/19658\n* fix(core): prevent OAuth server crash on unexpected requests by @reyyanxahmed in https://github.com/google-gemini/gemini-cli/pull/19668\n* feat: Map tool kinds to explicit ACP.ToolKind values and update test \u2026 by @sripasg in https://github.com/google-gemini/gemini-cli/pull/19547\n* chore: restrict gemini-automted-issue-triage to only allow echo by @galz10 in https://github.com/google-gemini/gemini-cli/pull/20047\n* Allow ask headers longer than 16 chars by @scidomino in https://github.com/google-gemini/gemini-cli/pull/20041\n* fix(core): prevent state corruption in McpClientManager during collis by @h30s in https://github.com/google-gemini/gemini-cli/pull/19782\n* fix(bundling): copy devtools package to bundle for runtime resolution by @SandyTao520 in https://github.com/google-gemini/gemini-cli/pull/19766\n* feat(policy): Support MCP Server Wildcards in Policy Engine by @jerop in https://github.com/google-gemini/gemini-cli/pull/20024\n* docs(CONTRIBUTING): update React DevTools version to 6 by @mmgok in https://github.com/google-gemini/gemini-cli/pull/20014\n* feat(core): optimize tool descriptions and schemas for Gemini 3 by @aishaneeshah in https://github.com/google-gemini/gemini-cli/pull/19643\n* feat(core): implement experimental direct web fetch by @mbleigh in https://github.com/google-gemini/gemini-cli/pull/19557\n* feat(core): replace expected_replacements with allow_multiple in replace tool by @SandyTao520 in https://github.com/google-gemini/gemini-cli/pull/20033\n* fix(sandbox): harden image packaging integrity checks by @aviralgarg05 in https://github.com/google-gemini/gemini-cli/pull/19552\n* fix(core): allow environment variable expansion and explicit overrides for MCP servers by @galz10 in https://github.com/google-gemini/gemini-cli/pull/18837\n* feat(policy): Implement Tool Annotation Matching in Policy Engine by @jerop in https://github.com/google-gemini/gemini-cli/pull/20029\n* fix(core): prevent utility calls from changing session active model by @adamfweidman in https://github.com/google-gemini/gemini-cli/pull/20035\n* fix(cli): skip workspace policy loading when in home directory by @Abhijit-2592 in https://github.com/google-gemini/gemini-cli/pull/20054\n* fix(scripts): Add Windows (win32/x64) support to lint.js by @ZafeerMahmood in https://github.com/google-gemini/gemini-cli/pull/16193\n* fix(a2a-server): Remove unsafe type assertions in agent by @Nixxx19 in https://github.com/google-gemini/gemini-cli/pull/19723\n* Fix: Handle corrupted token file gracefully when switching auth types (#19845) by @Nixxx19 in https://github.com/google-gemini/gemini-cli/pull/19850\n* fix critical dep vulnerability by @scidomino in https://github.com/google-gemini/gemini-cli/pull/20087\n* Add new setting to configure maxRetries by @kevinjwang1 in https://github.com/google-gemini/gemini-cli/pull/20064\n* Stabilize tests. by @gundermanc in https://github.com/google-gemini/gemini-cli/pull/20095\n* make windows tests mandatory by @scidomino in https://github.com/google-gemini/gemini-cli/pull/20096\n\n## New Contributors\n* @Nixxx19 made their first contribution in https://github.com/google-gemini/gemini-cli/pull/19891\n* @reyyanxahmed made their first contribution in https://github.com/google-gemini/gemini-cli/pull/19668\n* @h30s made their first contribution in https://github.com/google-gemini/gemini-cli/pull/19782\n* @mmgok made their first contribution in https://github.com/google-gemini/gemini-cli/pull/20014\n* @aviralgarg05 made their first contribution in https://github.com/google-gemini/gemini-cli/pull/19552\n* @ZafeerMahmood made their first contribution in https://github.com/google-gemini/gemini-cli/pull/16193\n\n**Full Changelog**: https://github.com/google-gemini/gemini-cli/compare/v0.30.0-nightly.20260223.c537fd5ae...v0.30.0-nightly.20260224.544df749a",
      "impact": "minor"
    }
  ],
  "capabilitiesAdded": [],
  "capabilitiesModified": [],
  "capabilitiesRemoved": [],
  "agent": "Gemini CLI"
}