{
  "version": "v0.0.415-1",
  "releaseDate": "2026-02-23",
  "sourceUrl": "https://github.com/github/copilot-cli/releases/tag/v0.0.415-1",
  "changes": [
    {
      "type": "feature",
      "description": "**Added**\n- Add show_file tool for presenting code and diffs to the user\n- Add env loading indicator showing skills, MCPs, plugins, ... being loaded\n\n**Improved**\n- `/mcp show` groups servers into User, Workspace, Plugins, and Built-in sections and makes all servers navigable\n- Agent now knows which model is powering it when asked\n- Ctrl+A/E cycle through visual lines in wrapped input; Home/End navigate within a visual line; Ctrl+Home/End jump to text boundaries\n\n**Fixed**\n- MCP tool results with giant single lines are truncated correctly\n- /plugin marketplace add and /plugin install support local paths containing spaces",
      "impact": "minor"
    }
  ],
  "capabilitiesAdded": [],
  "capabilitiesModified": [],
  "capabilitiesRemoved": [],
  "agent": "GitHub Copilot CLI"
}