{
  "version": "v0.33.0-preview.14",
  "releaseDate": "2026-03-10",
  "sourceUrl": "https://github.com/google-gemini/gemini-cli/releases/tag/v0.33.0-preview.14",
  "changes": [
    {
      "type": "feature",
      "description": "## What's Changed\n* fix(patch): cherry-pick 1b69637 to release/v0.33.0-preview.13-pr-21467 [CONFLICTS] by @gemini-cli-robot in https://github.com/google-gemini/gemini-cli/pull/21930\n\n\n**Full Changelog**: https://github.com/google-gemini/gemini-cli/compare/v0.33.0-preview.13...v0.33.0-preview.14",
      "impact": "minor"
    }
  ],
  "capabilitiesAdded": [],
  "capabilitiesModified": [],
  "capabilitiesRemoved": [],
  "agent": "Gemini CLI"
}