{
  "version": "v0.34.0-nightly.20260307.6c3a90645",
  "releaseDate": "2026-03-07",
  "sourceUrl": "https://github.com/google-gemini/gemini-cli/releases/tag/v0.34.0-nightly.20260307.6c3a90645",
  "changes": [
    {
      "type": "feature",
      "description": "## What's Changed\n* Changelog for v0.33.0-preview.2 by @gemini-cli-robot in https://github.com/google-gemini/gemini-cli/pull/21333\n* Changelog for v0.33.0-preview.3 by @gemini-cli-robot in https://github.com/google-gemini/gemini-cli/pull/21347\n* docs: format release times as HH:MM UTC by @pavan-sh in https://github.com/google-gemini/gemini-cli/pull/20726\n* fix(cli): implement --all flag for extensions uninstall by @sehoon38 in https://github.com/google-gemini/gemini-cli/pull/21319\n* docs: fix incorrect relative links to command reference by @kanywst in https://github.com/google-gemini/gemini-cli/pull/20964\n* documentiong ensures ripgrep by @Jatin24062005 in https://github.com/google-gemini/gemini-cli/pull/21298\n* fix(core): handle AbortError thrown during processTurn by @MumuTW in https://github.com/google-gemini/gemini-cli/pull/21296\n* docs(cli): clarify ! command output visibility in shell commands tutorial by @MohammedADev in https://github.com/google-gemini/gemini-cli/pull/21041\n* fix: logic for task tracker strategy and remove tracker tools by @anj-s in https://github.com/google-gemini/gemini-cli/pull/21355\n* fix(partUtils): display media type and size for inline data parts by @Aboudjem in https://github.com/google-gemini/gemini-cli/pull/21358\n* Fix(accessibility): add screen reader support to RewindViewer by @Famous077 in https://github.com/google-gemini/gemini-cli/pull/20750\n* fix(hooks): propagate stopHookActive in AfterAgent retry path (#20426) by @Aarchi-07 in https://github.com/google-gemini/gemini-cli/pull/20439\n* fix(core): deduplicate GEMINI.md files by device/inode on case-insensitive filesystems (#19904) by @Nixxx19 in https://github.com/google-gemini/gemini-cli/pull/19915\n* feat(core): add concurrency safety guidance for subagent delegation (#17753) by @abhipatel12 in https://github.com/google-gemini/gemini-cli/pull/21278\n* feat(ui): dynamically generate all keybinding hints by @scidomino in https://github.com/google-gemini/gemini-cli/pull/21346\n* feat(core): implement unified KeychainService and migrate token storage by @ehedlund in https://github.com/google-gemini/gemini-cli/pull/21344\n* fix(cli): gracefully handle --resume when no sessions exist by @SandyTao520 in https://github.com/google-gemini/gemini-cli/pull/21429\n* fix(plan): keep approved plan during chat compression by @ruomengz in https://github.com/google-gemini/gemini-cli/pull/21284\n* feat(core): implement generic CacheService and optimize setupUser by @sehoon38 in https://github.com/google-gemini/gemini-cli/pull/21374\n* Update quota and pricing documentation with subscription tiers by @srithreepo in https://github.com/google-gemini/gemini-cli/pull/21351\n* fix(core): append correct OTLP paths for HTTP exporters by @sebastien-prudhomme in https://github.com/google-gemini/gemini-cli/pull/16836\n* Changelog for v0.33.0-preview.4 by @gemini-cli-robot in https://github.com/google-gemini/gemini-cli/pull/21354\n* feat(cli): implement dot-prefixing for slash command conflicts by @ehedlund in https://github.com/google-gemini/gemini-cli/pull/20979\n* refactor(core): standardize MCP tool naming to mcp_ FQN format by @abhipatel12 in https://github.com/google-gemini/gemini-cli/pull/21425\n* feat(cli): hide gemma settings from display and mark as experimental by @abhipatel12 in https://github.com/google-gemini/gemini-cli/pull/21471\n* feat(skills): refine string-reviewer guidelines and description by @clocky in https://github.com/google-gemini/gemini-cli/pull/20368\n\n## New Contributors\n* @kanywst made their first contribution in https://github.com/google-gemini/gemini-cli/pull/20964\n* @Jatin24062005 made their first contribution in https://github.com/google-gemini/gemini-cli/pull/21298\n* @MumuTW made their first contribution in https://github.com/google-gemini/gemini-cli/pull/21296\n* @MohammedADev made their first contribution in https://github.com/google-gemini/gemini-cli/pull/21041\n* @Aboudjem made their first contribution in https://github.com/google-gemini/gemini-cli/pull/21358\n* @Famous077 made their first contribution in https://github.com/google-gemini/gemini-cli/pull/20750\n* @Aarchi-07 made their first contribution in https://github.com/google-gemini/gemini-cli/pull/20439\n* @sebastien-prudhomme made their first contribution in https://github.com/google-gemini/gemini-cli/pull/16836\n\n**Full Changelog**: https://github.com/google-gemini/gemini-cli/compare/v0.34.0-nightly.20260306.a8f507352...v0.34.0-nightly.20260307.6c3a90645",
      "impact": "minor"
    }
  ],
  "capabilitiesAdded": [],
  "capabilitiesModified": [],
  "capabilitiesRemoved": [],
  "agent": "Gemini CLI"
}