{
  "version": "v0.33.0-preview.7",
  "releaseDate": "2026-03-09",
  "sourceUrl": "https://github.com/google-gemini/gemini-cli/releases/tag/v0.33.0-preview.7",
  "changes": [
    {
      "type": "feature",
      "description": "**Full Changelog**: https://github.com/google-gemini/gemini-cli/compare/v0.33.0-preview.6...v0.33.0-preview.7",
      "impact": "minor"
    }
  ],
  "capabilitiesAdded": [],
  "capabilitiesModified": [],
  "capabilitiesRemoved": [],
  "agent": "Gemini CLI"
}