{
  "version": "v0.0.407-1",
  "releaseDate": "2026-02-10",
  "sourceUrl": "https://github.com/github/copilot-cli/releases/tag/v0.0.407-1",
  "changes": [
    {
      "type": "feature",
      "description": "**Added**\n- Add `/instructions` command to view and toggle custom instruction files\n\n**Improved**\n- Show agent type and description in read_agent timeline entries\n- Ctrl-b and ctrl-f cursor movement now available on all platforms\n\n**Fixed**\n- Subagents fall back to session model when default model blocked by policy\n- Editing MCP servers shows existing configuration values",
      "impact": "minor"
    }
  ],
  "capabilitiesAdded": [],
  "capabilitiesModified": [],
  "capabilitiesRemoved": [],
  "agent": "GitHub Copilot CLI"
}