{
  "version": "v0.0.411-0",
  "releaseDate": "2026-02-16",
  "sourceUrl": "https://github.com/github/copilot-cli/releases/tag/v0.0.411-0",
  "changes": [
    {
      "type": "feature",
      "description": "**Added**\n- Text selection now works in footer area in alt-screen mode\n- Support `--alt-screen on` and `--alt-screen off` syntax\n- SDK APIs for plan mode, autopilot, fleet, and workspace files\n\n**Fixed**\n- Interactive shell commands complete on all versions of Windows\n- Reduce memory usage in alt-screen mode during long sessions\n- Terminal bell rings once when agent finishes, not on every tool completion\n- Improve text selection responsiveness in --alt-screen mode",
      "impact": "minor"
    }
  ],
  "capabilitiesAdded": [],
  "capabilitiesModified": [],
  "capabilitiesRemoved": [],
  "agent": "GitHub Copilot CLI"
}