{
  "version": "v0.0.406",
  "releaseDate": "2026-02-07",
  "sourceUrl": "https://github.com/github/copilot-cli/releases/tag/v0.0.406",
  "changes": [
    {
      "type": "feature",
      "description": "2026-02-07\n\n- Add support for Claude Opus 4.6 Fast (Preview)\n- Markdown formatting displays in non-interactive mode output\n- Display warning when user has no Copilot subscription\n- Commands from plugins are now translated into skills\n- Add `/changelog` command to view release notes\n- plugin marketplace add accepts URLs as sources\n- `--no-experimental` flag disables experimental features\n- CLI interface renders without extra blank line\n- `/mcp show` displays enabled/disabled status for MCP tools\n- MCP tool responses now include structured content (images, resources) for richer UI display in VS Code\n",
      "impact": "minor"
    }
  ],
  "capabilitiesAdded": [],
  "capabilitiesModified": [],
  "capabilitiesRemoved": [],
  "agent": "GitHub Copilot CLI"
}