{
  "version": "v0.0.416",
  "releaseDate": "2026-02-24",
  "sourceUrl": "https://github.com/github/copilot-cli/releases/tag/v0.0.416",
  "changes": [
    {
      "type": "feature",
      "description": "2026-02-24\n\n- Expand `--help` content with descriptions, examples, and sorted flags\n- Block third-party MCP servers when the Copilot MCP policy does not allow them\n- Streaming response size counter updates continuously during tool calls and reasoning, and resets between requests\n- Status line automatically switches to a two-line layout on narrow terminals, keeping CWD, branch, and model info readable at any terminal width\n- Undo operations now always require confirmation\n",
      "impact": "minor"
    }
  ],
  "capabilitiesAdded": [],
  "capabilitiesModified": [],
  "capabilitiesRemoved": [],
  "agent": "GitHub Copilot CLI"
}